{
  "schema_name": "macos-local-vm-interruption-profile",
  "schema_version": "1.0.0",
  "profile_id": "iar-macos-local-vm-interruption-v1",
  "profile_version": "1.0.0",
  "controller_profile_id": "iar-macos-local-vm-synthetic-matrix-v1",
  "controller_profile_digest": "sha256:a411dc8d896b9b516cb535786fe2d12f17c6bfed3b39b2104c040e7556507522",
  "automated_evidence": "synthetic-job-private-trigger",
  "manual_evidence_required": "os-will-sleep",
  "limits": {
    "readiness_ms": "10000",
    "completion_ms": "10000",
    "captured_stdout_bytes": "65536",
    "captured_stderr_bytes": "16384"
  },
  "controls": {
    "operating_system_sleep_observer": true,
    "shared_fail_closed_stop_handler": true,
    "synthetic_interruption_trigger": true,
    "exact_child_reap": true,
    "exact_stale_job_removal": true,
    "post_interruption_recovery_job": true,
    "real_host_sleep_observed": false,
    "analyzer_execution": false,
    "production_admitted": false,
    "authority_added": false
  }
}
